{
  "$schema": "https://viggomeesters.github.io/schemas/repo-vision-contract.schema.json",
  "schema_version": "1.0.0",
  "artifact_kind": "repo_design_vision_contract",
  "repo": {
    "name": "guru-benchmark",
    "primary_users": ["developers", "technical leaders", "AI agents", "reviewers"],
    "product_surface": "agent_first"
  },
  "vision": {
    "one_line": "A living, source-grounded expert council for repeatable technical judgment.",
    "north_star": "Make world-class technical judgment reusable, source-grounded, updateable, and executable without reducing experts to role-play.",
    "promise": "Produce one context-weighted Guru Verdict with confidence, hard gates, disagreement clarification, an aspirational design, and ordered next moves.",
    "wedge": "Begin with a transparent and versioned AI-engineering benchmark built around a fixed seven-member founding council."
  },
  "principles": [
    {"id": "evidence-before-persona", "title": "Evidence before persona", "rule": "Expert positions require dated public evidence, an explicit inference label, or abstention.", "good": ["Source identifiers and confidence are attached to every lens claim."], "bad": ["Invented quotations or claims based only on reputation."]},
    {"id": "context-before-consensus", "title": "Context before consensus", "rule": "The operating context and decision domain determine which evidence is relevant and how strongly it counts.", "good": ["Weights explain domain relevance and user constraints."], "bad": ["Universal advice detached from scale, risk, or environment."]},
    {"id": "weighted-synthesis", "title": "Weighted synthesis", "rule": "Aggregate with transparent relevance and confidence weights rather than equal voting or an opaque mean.", "good": ["Weighted median and contribution rationale are recorded."], "bad": ["Seven equally weighted celebrity opinions."]},
    {"id": "hard-gates-first", "title": "Hard gates first", "rule": "Critical failures in correctness, security, privacy, recovery, or evidence cap the verdict before scoring.", "good": ["Blockers appear before totals and have explicit effects."], "bad": ["A high average hiding a catastrophic weakness."]},
    {"id": "clarify-disagreement", "title": "Clarify material disagreement", "rule": "Return one default answer while explaining divergence whenever it could change the recommended decision.", "good": ["Dispersion and competing trade-offs are visible."], "bad": ["Forced consensus or seven repetitive essays."]},
    {"id": "temporal-reproducibility", "title": "Temporal reproducibility", "rule": "Every verdict pins immutable benchmark and lens snapshots with a dated source cutoff.", "good": ["Historical evaluations replay against exact versions."], "bad": ["Latest aliases silently rewriting old conclusions."]},
    {"id": "current-vs-north-star", "title": "Current versus North Star", "rule": "Observed implementation quality and aspirational design quality are scored separately.", "good": ["Evidence-backed Current Score and conditional North Star Score."], "bad": ["Treating intended design as shipped behavior."]},
    {"id": "action-over-admiration", "title": "Action over admiration", "rule": "Every evaluation ends with ordered, testable next moves and explicit non-actions.", "good": ["Small changes with acceptance evidence."], "bad": ["Name-dropping without a decision or action."]},
    {"id": "public-safe-by-construction", "title": "Public-safe by construction", "rule": "Public artifacts contain no secrets, private profiles, copyrighted corpora, or unsupported personal claims.", "good": ["Synthetic fixtures and source metadata without copied corpora."], "bad": ["Private vault content or access credentials committed to Git."]}
  ],
  "non_goals": ["Impersonate or simulate living people.", "Declare a universally correct guru.", "Republish source corpora or copyrighted transcripts.", "Build hosted infrastructure during foundation."],
  "assumptions": ["Public evidence can support bounded expert-lens snapshots.", "Some lenses will abstain for insufficient relevance or evidence.", "Transparent weighting and hard gates can improve review consistency.", "Users prefer one synthesis with optional clarification over many essays."],
  "public_safety": {
    "forbidden": ["secrets and credentials", "private user or vault data", "customer or proprietary material", "fabricated quotations", "copyrighted source corpora"],
    "required_boundaries": ["public-source provenance", "inference and confidence labels", "synthetic fixtures only", "generated runtime state outside Git", "no claims of affiliation or endorsement"]
  },
  "acceptance_scorecard": [
    {"id": "source-grounded", "question": "Are lens claims traceable to dated public sources?", "pass_condition": "Every claim has evidence, inference, or abstention status."},
    {"id": "contextual", "question": "Does the evaluation incorporate domain and operating context?", "pass_condition": "Context profile and relevance rationale are present."},
    {"id": "transparent-weights", "question": "Can a reviewer explain the council weighting?", "pass_condition": "Weights, confidence, and contribution roles are recorded."},
    {"id": "hard-gates", "question": "Can critical failures be averaged away?", "pass_condition": "No; gate effects are applied before aggregate scores."},
    {"id": "disagreement", "question": "Is material divergence visible?", "pass_condition": "Clarification is emitted above the configured dispersion threshold."},
    {"id": "reproducible", "question": "Can the verdict be replayed later?", "pass_condition": "Exact benchmark, lens snapshots, source cutoff, and context version are pinned."},
    {"id": "honest-scores", "question": "Are current and aspirational states separate?", "pass_condition": "Current Score and North Star Score use distinct evidence rules."},
    {"id": "actionable", "question": "Does the output drive work?", "pass_condition": "Ordered next moves include verification and explicit non-actions."},
    {"id": "public-safe", "question": "Is the repository safe to publish?", "pass_condition": "No private data, secrets, copied corpora, endorsement claims, or unsafe fixtures."}
  ],
  "review_checklist": ["Verify source dates and stable identifiers.", "Reject unsupported quotations.", "Check dimension weights and hard-gate effects.", "Inspect disagreement and abstention handling.", "Keep current and North Star evidence separate.", "Confirm public-safety and non-affiliation wording."],
  "maturity_model": [
    {"level": "L0", "state": "schema_valid", "meaning": "Contracts parse and validate."},
    {"level": "L1", "state": "fixture_proven", "meaning": "Synthetic evaluations exercise weighting, gates, abstention, and clarification."},
    {"level": "L2", "state": "source_grounded", "meaning": "Versioned public-source lens snapshots drive reproducible evaluations."},
    {"level": "L3", "state": "operational", "meaning": "CLI and agent integrations produce reviewable Guru Verdicts."}
  ],
  "residual_risk_wording": "A Guru Verdict is a source-grounded decision aid, not an endorsement, quotation, or substitute for domain-specific professional review."
}
